{
  "layerCount": 200,
  "componentCount": 1,
  "assetCount": 0,
  "warningCount": 11,
  "warningCap": 10,
  "exceededWarningCap": true,
  "overrideUsed": false,
  "largeDocument": false,
  "timings": {
    "fetch": 0,
    "preScan": 0,
    "transform": 1,
    "assets": 0,
    "emit": 2,
    "write": 0,
    "total": 0
  },
  "versionDir": "v20250927-2059-e825c9b1",
  "variants": [],
  "variantConflicts": []
}