{
  "layerCount": 1,
  "componentCount": 1,
  "assetCount": 0,
  "warningCount": 50,
  "warningCap": 0,
  "exceededWarningCap": false,
  "overrideUsed": true,
  "largeDocument": false,
  "timings": {
    "fetch": 0,
    "preScan": 0,
    "transform": 0,
    "assets": 0,
    "emit": 2,
    "write": 0,
    "total": 0
  },
  "versionDir": "v20250927-2059-9c6d1cd8",
  "variants": [],
  "variantConflicts": []
}